{
  "bundleVersion": "dashboard-replay-bundle/v1",
  "sessionId": "session-reducer-parity",
  "scenarioId": "wilderness-missing-person",
  "scenarioRevision": 1,
  "initialState": {
    "canonicalizationVersion": 1,
    "stateVersion": 1,
    "currentMission": {
      "identifier": "mission-synthetic-parity",
      "lifecycle": "PLANNED",
      "predecessorIdentifier": null
    },
    "fleet": [
      {
        "identifier": "drone-comms-03",
        "participation": "DECLARED_ONLY"
      },
      {
        "identifier": "drone-sim-01",
        "participation": "SIMULATED",
        "connectivity": "CONNECTED",
        "telemetry": null
      },
      {
        "identifier": "drone-sim-07",
        "participation": "SIMULATED",
        "connectivity": "CONNECTED",
        "telemetry": null
      }
    ],
    "latestAuditOrdinal": 0,
    "sectors": [
      {
        "identifier": "sector-01",
        "state": "UNASSIGNED",
        "assignedMemberId": null
      }
    ]
  },
  "latestEventDigest": null,
  "events": [
    {
      "auditOrdinal": 1,
      "event": {
        "kind": "missionLifecycle",
        "eventClass": "MISSION",
        "mission": "mission-synthetic-parity",
        "time": "2026-08-25T12:00:01.000Z",
        "data": {
          "lifecycle": "SEARCHING"
        }
      }
    },
    {
      "auditOrdinal": 2,
      "event": {
        "kind": "sectorLifecycle",
        "eventClass": "MISSION",
        "mission": "mission-synthetic-parity",
        "time": "2026-08-25T12:00:02.000Z",
        "data": {
          "sectorId": "sector-01",
          "state": "ASSIGNED",
          "assignedMemberId": "drone-sim-07"
        }
      }
    },
    {
      "auditOrdinal": 3,
      "event": {
        "kind": "droneTelemetry",
        "eventClass": "TELEMETRY",
        "mission": "mission-synthetic-parity",
        "time": "2026-08-25T12:00:03.000Z",
        "data": {
          "droneId": "drone-sim-07",
          "latitudeMicrodegrees": 44475000,
          "longitudeMicrodegrees": -79245000,
          "batteryPercent": 91,
          "altitudeMetres": 84,
          "headingDegrees": 45,
          "groundSpeedCentimetresPerSecond": 950
        }
      }
    },
    {
      "auditOrdinal": 4,
      "event": {
        "kind": "connectivityChanged",
        "eventClass": "CONNECTIVITY",
        "mission": "mission-synthetic-parity",
        "time": "2026-08-25T12:00:04.000Z",
        "data": {
          "droneId": "drone-sim-07",
          "connectivity": "DEGRADED"
        }
      }
    },
    {
      "auditOrdinal": 5,
      "event": {
        "kind": "sectorLifecycle",
        "eventClass": "MISSION",
        "mission": "mission-synthetic-parity",
        "time": "2026-08-25T12:00:05.000Z",
        "data": {
          "sectorId": "sector-01",
          "state": "AT_RISK",
          "assignedMemberId": "drone-sim-07"
        }
      }
    },
    {
      "auditOrdinal": 6,
      "event": {
        "kind": "connectivityChanged",
        "eventClass": "CONNECTIVITY",
        "mission": "mission-synthetic-parity",
        "time": "2026-08-25T12:00:06.000Z",
        "data": {
          "droneId": "drone-sim-07",
          "connectivity": "OFFLINE"
        }
      }
    },
    {
      "auditOrdinal": 7,
      "event": {
        "kind": "droneTelemetry",
        "eventClass": "TELEMETRY",
        "mission": "mission-synthetic-parity",
        "time": "2026-08-25T12:00:07.000Z",
        "data": {
          "droneId": "drone-sim-01",
          "latitudeMicrodegrees": 44475100,
          "longitudeMicrodegrees": -79245100,
          "batteryPercent": 89,
          "altitudeMetres": 86,
          "headingDegrees": 90,
          "groundSpeedCentimetresPerSecond": 975
        }
      }
    },
    {
      "auditOrdinal": 8,
      "event": {
        "kind": "connectivityChanged",
        "eventClass": "CONNECTIVITY",
        "mission": "mission-synthetic-parity",
        "time": "2026-08-25T12:00:08.000Z",
        "data": {
          "droneId": "drone-sim-07",
          "connectivity": "CONNECTED"
        }
      }
    },
    {
      "auditOrdinal": 9,
      "event": {
        "kind": "sectorLifecycle",
        "eventClass": "MISSION",
        "mission": "mission-synthetic-parity",
        "time": "2026-08-25T12:00:09.000Z",
        "data": {
          "sectorId": "sector-01",
          "state": "ASSIGNED",
          "assignedMemberId": "drone-sim-07"
        }
      }
    },
    {
      "auditOrdinal": 10,
      "event": {
        "kind": "droneTelemetry",
        "eventClass": "TELEMETRY",
        "mission": "mission-synthetic-parity",
        "time": "2026-08-25T12:00:10.000Z",
        "data": {
          "droneId": "drone-sim-07",
          "latitudeMicrodegrees": 44475200,
          "longitudeMicrodegrees": -79245200,
          "batteryPercent": 85,
          "altitudeMetres": 88,
          "headingDegrees": 135,
          "groundSpeedCentimetresPerSecond": 925
        }
      }
    },
    {
      "auditOrdinal": 11,
      "event": {
        "kind": "sectorLifecycle",
        "eventClass": "MISSION",
        "mission": "mission-synthetic-parity",
        "time": "2026-08-25T12:00:11.000Z",
        "data": {
          "sectorId": "sector-01",
          "state": "SEARCHED",
          "assignedMemberId": "drone-sim-07"
        }
      }
    },
    {
      "auditOrdinal": 12,
      "event": {
        "kind": "missionLifecycle",
        "eventClass": "MISSION",
        "mission": "mission-synthetic-parity",
        "time": "2026-08-25T12:00:12.000Z",
        "data": {
          "lifecycle": "EXHAUSTED"
        }
      }
    }
  ],
  "integrity": {
    "integrityVersion": "dashboard-replay-integrity/v1",
    "algorithm": "sha256",
    "checksum": "7cb1e9c44062a95353a6520011a83b81ac40720fbd55c934a5dbcc0900c323bc",
    "expectedFinalDigest": "03fdb85dfded6c6914cfea269934716d619510f638cae3b7bc67adcedbcbc357"
  }
}
